<!ELEMENT employees (employee*)>

<!ELEMENT employee (empid, name, salary, dept, phone, email)>

<!ELEMENT empid (#PCDATA)>
<!ELEMENT name (#PCDATA)>
<!ELEMENT salary (#PCDATA)>
<!ELEMENT dept (#PCDATA)>
<!ELEMENT phone (#PCDATA)>
<!ELEMENT email (#PCDATA)>